{
  "sourceId": "SRC056",
  "recipeVersion": "clean108-state-recipe-v1",
  "viewport": {
    "width": 1280,
    "height": 800,
    "deviceScaleFactor": 1,
    "reducedMotion": "reduce"
  },
  "stateId": "ORIGIN_REVEAL",
  "preconditions": [],
  "actions": [
    {
      "type": "evaluateHook",
      "hook": "__lt.originReveal",
      "arg": null
    },
    {
      "type": "waitForRuntime",
      "path": "__lt.state.mode",
      "equals": "ORIGIN_REVEAL"
    },
    {
      "type": "settle",
      "clearToast": "#toast",
      "rAF": 2,
      "waitMs": 50
    }
  ],
  "settleCondition": {},
  "assertions": [
    {
      "type": "runtime",
      "path": "__lt.state.mode",
      "equals": "ORIGIN_REVEAL"
    },
    {
      "type": "visible",
      "selector": "#stage"
    },
    {
      "type": "text",
      "selector": "#modePill",
      "equals": "ORIGIN · REVEAL"
    }
  ],
  "screenshots": [
    {
      "name": "origin-reveal",
      "animations": "disabled",
      "digest": "raw"
    }
  ],
  "runtimeHook": {
    "name": "__lt",
    "snapshotFields": [
      "state.mode",
      "state.scale",
      "state.tx",
      "state.ty"
    ]
  },
  "allowedTolerance": {
    "geometryEpsPx": 0,
    "floatDecimals": 3,
    "canonicalHammingMax": 0,
    "screenshot": "EXACT"
  },
  "timeouts": {
    "actionMs": 5000,
    "recipeMs": 15000
  },
  "notes": "CLEAN-108 M1 Slice 4 SIMPLE proof recipe derived from the already-accepted SRC056 ORIGIN_REVEAL baseline state. This recipe does not replace accepted parity evidence."
}
